{
  "kind": "directive.cohesionCatalog.v1",
  "schemaVersion": 1,
  "id": "breckenridge.cohesion.v1",
  "packageId": "directive:campaign-package:breckenridge-ashes-of-peace",
  "policy": {
    "levelWeights": { "1": 50, "2": 30, "3": 15, "4": 5 },
    "cooldownChecks": { "1": 3, "2": 6, "3": 12 },
    "schedule": {
      "warmupHours": 4,
      "intervalHours": 12,
      "boundaryMinimumHours": 4,
      "targetUnresolved": 3,
      "crowdedThreshold": 8,
      "normalChancePercent": 35,
      "crowdedChancePercent": 15,
      "criticalPauseBelow": 40,
      "visibleLimit": 5
    },
    "generationGuards": [
      {
        "id": "long-watch-recovery",
        "sourceTemplateId": "cohesion.l4.long-watch",
        "remainingChecks": 2,
        "suppressTags": ["fatigue", "workload"],
        "templateTags": {
          "cohesion.l1.missed-watch": ["fatigue"],
          "cohesion.l1.no-relief-roster": ["fatigue", "workload"],
          "cohesion.l1.needed-day-off": ["fatigue", "workload"],
          "cohesion.l1.quiet-hours": ["fatigue"],
          "cohesion.l2.falling-behind": ["workload"],
          "cohesion.l4.long-watch": ["fatigue", "workload"]
        }
      }
    ]
  },
  "backgroundCrew": {
    "names": [
      "Ari Chen", "Bela Okafor", "Caro Thale", "Davin Ruiz", "Eli Venn", "Farah Noor",
      "Galen Price", "Hana Mori", "Ilya Petrov", "Jae Min", "Kato Dalen", "Leena Shah",
      "Mara Tovin", "Nico Alvarez", "Orin Pell", "Pema Rios", "Quinn Mercer", "Ravi Sen",
      "Sela Tor", "Tarin Cole", "Uma Velez", "Vik Anand", "Wren Solari", "Yara N'Dour"
    ],
    "pronouns": ["she/her", "he/him", "they/them"],
    "ranks": ["Crewman", "Petty Officer", "Chief Petty Officer", "Ensign", "Lieutenant Junior Grade"],
    "departments": ["command", "operations", "engineering", "science", "medical", "security", "flight"],
    "watches": ["alpha", "beta", "gamma"],
    "qualifications": ["damage control", "shuttle operations", "sensor watch", "systems maintenance", "medical response", "security response", "logistics custody"]
  },
  "authoredIssues": [
    {
      "id": "cohesion-authored.sensor-calibration",
      "systemId": "ship-system.sensor-calibration",
      "terminalStateId": "ship-state.sensors.validated",
      "level": 2,
      "primaryFamily": "systems",
      "anchor": "forward-sensors",
      "conditionId": "sensor_calibration_provisional",
      "playerText": {
        "title": "Sensor Calibration",
        "situation": "The refit sensor-processing stack works, but its fine correlation remains provisional.",
        "objective": "Coordinate Operations and Science through an independent baseline and a sustained live-load validation.",
        "whyItMatters": "Completion restores 10 Cohesion and makes the ship's authored correlation and reconstruction capabilities available when their evidence contracts permit them.",
        "operationalEffect": "Fine identity, provenance, and reconstruction claims require independent corroboration."
      },
      "computerHelp": "Ask for the accepted calibration evidence, the next available validation milestone, eligible independent references, and the departments needed to pursue it.",
      "phaseMilestoneIds": ["ship-milestone.sensor-controlled-baseline", "ship-milestone.sensor-live-load-validation"]
    },
    {
      "id": "cohesion-authored.systems-integration",
      "systemId": "ship-system.systems-integration",
      "terminalStateId": "ship-state.integration.integrated",
      "level": 3,
      "primaryFamily": "systems",
      "anchor": "engineering",
      "conditionId": "refit_integration_unproven",
      "playerText": {
        "title": "Systems Integration",
        "situation": "The refit restored individual systems faster than it proved they can work together under sustained load.",
        "objective": "Authorize controlled isolation, combined-load, and failover work while commanding the risk and coordination around it.",
        "whyItMatters": "Completion restores 15 Cohesion and unlocks the ship's existing authored integration capabilities when their evidence contracts pass.",
        "operationalEffect": "Unsupported full-system shortcuts remain unsafe because one refit fault can cascade across systems."
      },
      "computerHelp": "Ask for the accepted integration evidence, the next available validation milestone, safe test categories, and affected departments.",
      "phaseMilestoneIds": ["ship-milestone.integration-isolation-test", "ship-milestone.integration-combined-load-test", "ship-milestone.integration-failover-validation"]
    }
  ],
  "templates": [
    {"id":"cohesion.l1.missed-watch","version":1,"title":"The Missed Watch","level":1,"cohesion":5,"primaryFamily":"personnel","secondaryFamilies":["training"],"bindingMode":"backgroundOnly","bindingRoles":["crewmember","supervisor","department","watch"],"anchor":"central-saucer","playerText":{"situation":"A crewmember missed or arrived late for an important watch, forcing improvised coverage.","objective":"Establish the cause, respond proportionately, and restore reliable coverage.","whyItMatters":"Reliable coverage prevents a future taxed scene from losing a qualified crewmember or suffering delay.","operationalEffect":"The department carries fragile watch coverage."},"phases":[{"id":"understand-absence","label":"Understand the absence"},{"id":"restore-coverage","label":"Restore coverage"}],"approaches":["private conversation","supervisor review","schedule support","proportionate coaching"],"computerHelp":"Identify the missed watch, current coverage, and who can clarify the cause without guessing it.","completion":{"guidance":"Complete only after command establishes a legitimate cause category and a credible arrangement for the next affected watch.","exclusions":["Punishment without cause is not completion.","Personally taking the watch is not a sustainable solution."]},"variations":["roster confusion","fatigue","unfamiliar reassignment","authorized personal need"],"narratorLimits":["Do not invent misconduct, addiction, romance, family crisis, illness, or deception."]},
    {"id":"cohesion.l1.new-to-ship","version":1,"title":"New to the Ship","level":1,"cohesion":5,"primaryFamily":"personnel","secondaryFamilies":["coordination"],"bindingMode":"backgroundOnly","bindingRoles":["newcomer","supervisor","peer","department"],"anchor":"central-saucer","playerText":{"situation":"A recent transfer meets formal requirements but remains outside the team's informal information flow.","objective":"Create a credible route into the team without forcing friendship or public embarrassment.","whyItMatters":"The team loses less time repeating context and gains a reliable working connection.","operationalEffect":"The team repeatedly loses context around the newcomer."},"phases":[{"id":"identify-gap","label":"Identify the gap"},{"id":"create-connection","label":"Create a connection"}],"approaches":["speak with the newcomer","coach the supervisor","assign a peer sponsor","include them in meaningful work"],"computerHelp":"Explain which routines the newcomer misses and suggest low-pressure working connections.","completion":{"guidance":"Complete after the practical exclusion is identified and one consent-respecting connection is established.","exclusions":["Ordering friendship is not completion.","A ceremonial welcome without working access is insufficient."]},"variations":["missed briefings","unfamiliar custom","shift mismatch","specialist jargon"],"narratorLimits":["Do not invent prejudice, hazing, trauma, romance, or personality defects."]},
    {"id":"cohesion.l1.message-from-home","version":1,"title":"Message From Home","level":1,"cohesion":5,"primaryFamily":"personnel","secondaryFamilies":["systems"],"bindingMode":"backgroundOnly","bindingRoles":["crewmember","supervisor","duty","coverage"],"anchor":"crew-habitat","playerText":{"situation":"A crewmember received a message from home and asks for a bounded accommodation while duty still needs coverage.","objective":"Protect the legitimate need and maintain credible duty coverage.","whyItMatters":"The crew sees that command can protect ordinary personal needs without treating them as failures.","operationalEffect":"The department carries distraction and coverage strain."},"phases":[{"id":"hear-request","label":"Hear the request"},{"id":"balance-need","label":"Balance need and duty"}],"approaches":["private conversation","schedule swap","temporary relief","protected communication time"],"computerHelp":"Provide the duty schedule and coverage categories while protecting the message's contents.","completion":{"guidance":"Complete after a humane command decision and workable coverage plan are accepted.","exclusions":["Demanding private details is not required.","Leave without coverage is insufficient."]},"variations":["time-sensitive call","family ceremony","administrative matter","limited communication window"],"narratorLimits":["Do not invent family conflict, depression, a breakup, illness, or crisis."]},